<?xml version="1.0" encoding="UTF-8"?>

<!--

    DO NOT ALTER OR REMOVE COPYRIGHT NOTICES OR THIS HEADER.

    Copyright (c) 1997-2014 Oracle and/or its affiliates. All rights reserved.

    The contents of this file are subject to the terms of either the GNU
    General Public License Version 2 only ("GPL") or the Common Development
    and Distribution License("CDDL") (collectively, the "License").  You
    may not use this file except in compliance with the License.  You can
    obtain a copy of the License at
    https://glassfish.dev.java.net/public/CDDL+GPL_1_1.html
    or packager/legal/LICENSE.txt.  See the License for the specific
    language governing permissions and limitations under the License.

    When distributing the software, include this License Header Notice in each
    file and include the License file at packager/legal/LICENSE.txt.

    GPL Classpath Exception:
    Oracle designates this particular file as subject to the "Classpath"
    exception as provided by Oracle in the GPL Version 2 section of the License
    file that accompanied this code.

    Modifications:
    If applicable, add the following below the License Header, with the fields
    enclosed by brackets [] replaced by your own identifying information:
    "Portions Copyright [year] [name of copyright owner]"

    Contributor(s):
    If you wish your version of this file to be governed by only the CDDL or
    only the GPL Version 2, indicate your decision by adding "[Contributor]
    elects to include this software in this distribution under the [CDDL or GPL
    Version 2] license."  If you don't indicate a single choice of license, a
    recipient has the option to distribute your version of this file under
    either the CDDL, the GPL Version 2 or to extend the choice of license to
    its licensees as provided above.  However, if you add GPL Version 2 code
    and therefore, elected the GPL Version 2 license, then the option applies
    only if the new code is made subject to such option by the copyright
    holder.

-->

<facelet-taglib xmlns="http://java.sun.com/xml/ns/javaee"
                xmlns:xsi="http://www.w3.org/2001/XMLSchema-instance"
                xsi:schemaLocation="http://java.sun.com/xml/ns/javaee http://java.sun.com/xml/ns/javaee/web-facelettaglibrary_2_0.xsd" 
                version="2.0">
    <namespace>http://www.oracle.com/mojarra/test/dynamic</namespace>
    <tag>
        <tag-name>toggleComponent</tag-name>
        <component>
            <component-type>com.sun.faces.test.servlet30.dynamic.ToggleComponent</component-type>
        </component>
    </tag>
    <tag>
        <tag-name>addcomponent</tag-name>
        <component>
            <component-type>com.sun.faces.test.servlet30.dynamic.AddComponent</component-type>
        </component>
    </tag>
    <tag>
        <tag-name>stablecomponent</tag-name>
        <component>
            <component-type>com.sun.faces.test.servlet30.dynamic.StableComponent</component-type>
        </component>
    </tag>
    <tag>
        <tag-name>tablecomponent</tag-name>
        <component>
            <component-type>com.sun.faces.test.servlet30.dynamic.TableComponent</component-type>
        </component>
    </tag>
    <tag>
        <tag-name>recursivecomponent</tag-name>
        <component>
            <component-type>com.sun.faces.test.servlet30.dynamic.RecursiveComponent</component-type>
        </component>
    </tag>
    <tag>
        <tag-name>addcomponent1</tag-name>
        <component>
            <component-type>com.sun.faces.test.servlet30.dynamic.AddComponent1</component-type>
        </component>
    </tag>
    <tag>
        <tag-name>movecomponent</tag-name>
        <component>
            <component-type>com.sun.faces.test.servlet30.dynamic.MoveComponent</component-type>
        </component>
    </tag>
    <tag>
        <tag-name>movecomponent2</tag-name>
        <component>
            <component-type>com.sun.faces.test.servlet30.dynamic.MoveComponent2</component-type>
        </component>
    </tag>
</facelet-taglib>
